{
  "schema_version": "1.0.0",
  "deal_id": "524-lincoln-ave-pasadena",
  "archive": [
    {
      "id": "img-001",
      "filename": "zillow-d573ae36.jpg",
      "sha256": "650ae5b24a63f6b41d275272aae43545597d93d100e8a633abd9345e2432bef9",
      "phash": "fe4591bc70c72538",
      "source": "listing_portal",
      "source_url": "https://photos.zillowstatic.com/fp/d573ae36ccd06f69ef6bd845990d7e32-uncropped_scaled_within_1536_1152.jpg",
      "access_date": "2026-08-18",
      "category": "exterior",
      "width": 1440,
      "height": 1080,
      "stock_or_illustrative": false,
      "stock_basis": null,
      "property_match": "confirmed_human",
      "match_basis": "Published for 524 Lincoln Ave by the owner's property manager and confirmed by Glen as the subject building.",
      "reviewed_by": "Glen Scher",
      "reviewed_at": "2026-08-18T00:00:00Z",
      "rights_holder": "Property owner / Focus Property Services Inc.",
      "publication_basis": "seller_provided",
      "usage_scope": "LAAA valuation materials for the property owner",
      "required_credit": null,
      "status": "published",
      "rejected_reason": null,
      "rendered_width": 1440,
      "rendered_height": 1080,
      "exception_id": null
    },
    {
      "id": "img-002",
      "filename": "zillow-f1e91b3a.jpg",
      "sha256": "acace74b77272c8b47f1b55c8ab569c7ddd008065670f649dea71778b73013d0",
      "phash": "99e44d5ee4089b5b",
      "source": "listing_portal",
      "source_url": "https://photos.zillowstatic.com/fp/f1e91b3a32a3c5f7eab356d13bccbb39-uncropped_scaled_within_1536_1152.jpg",
      "access_date": "2026-08-18",
      "category": "exterior",
      "width": 1440,
      "height": 1080,
      "stock_or_illustrative": false,
      "stock_basis": null,
      "property_match": "confirmed_human",
      "match_basis": "Published for 524 Lincoln Ave by the owner's property manager and confirmed by Glen as the subject building.",
      "reviewed_by": "Glen Scher",
      "reviewed_at": "2026-08-18T00:00:00Z",
      "rights_holder": "Property owner / Focus Property Services Inc.",
      "publication_basis": "seller_provided",
      "usage_scope": "LAAA valuation materials for the property owner",
      "required_credit": null,
      "status": "published",
      "rejected_reason": null,
      "rendered_width": 1440,
      "rendered_height": 1080,
      "exception_id": null
    },
    {
      "id": "img-003",
      "filename": "zillow-e655814a.jpg",
      "sha256": "229953ced145f99a34e4b901fceceb20c9c55bdeec0f1cf7eee6b3b79ae8b79d",
      "phash": "b5cb469344b57964",
      "source": "listing_portal",
      "source_url": "https://photos.zillowstatic.com/fp/e655814a3f92e9ff0744461d348d865f-uncropped_scaled_within_1536_1152.jpg",
      "access_date": "2026-08-18",
      "category": "exterior",
      "width": 1440,
      "height": 1080,
      "stock_or_illustrative": false,
      "stock_basis": null,
      "property_match": "confirmed_human",
      "match_basis": "Published for 524 Lincoln Ave by the owner's property manager and confirmed by Glen as the subject building.",
      "reviewed_by": "Glen Scher",
      "reviewed_at": "2026-08-18T00:00:00Z",
      "rights_holder": "Property owner / Focus Property Services Inc.",
      "publication_basis": "seller_provided",
      "usage_scope": "LAAA valuation materials for the property owner",
      "required_credit": null,
      "status": "published",
      "rejected_reason": null,
      "rendered_width": 1440,
      "rendered_height": 1080,
      "exception_id": null
    },
    {
      "id": "img-004",
      "filename": "zillow-cbc0abab.jpg",
      "sha256": "bf95826b0dee019c930a03efbee6fbb3d8117f69bf034ef6b9d165265dc6a5da",
      "phash": "cad09569ecda4b25",
      "source": "listing_portal",
      "source_url": "https://photos.zillowstatic.com/fp/cbc0abab5488d6d7597aea40216348b0-uncropped_scaled_within_1536_1152.jpg",
      "access_date": "2026-08-18",
      "category": "exterior",
      "width": 1440,
      "height": 1080,
      "stock_or_illustrative": false,
      "stock_basis": null,
      "property_match": "confirmed_human",
      "match_basis": "Published for 524 Lincoln Ave by the owner's property manager and confirmed by Glen as the subject building.",
      "reviewed_by": "Glen Scher",
      "reviewed_at": "2026-08-18T00:00:00Z",
      "rights_holder": "Property owner / Focus Property Services Inc.",
      "publication_basis": "seller_provided",
      "usage_scope": "LAAA valuation materials for the property owner",
      "required_credit": null,
      "status": "published",
      "rejected_reason": null,
      "rendered_width": 1440,
      "rendered_height": 1080,
      "exception_id": null
    },
    {
      "id": "img-008",
      "filename": "zillow-c8931e21.jpg",
      "sha256": "fbb442113a96ddb3dee79e5f06c90c8266e1dd978ecd4e94394acdd59f0de40e",
      "phash": "f7e01e0ef1990c72",
      "source": "listing_portal",
      "source_url": "https://photos.zillowstatic.com/fp/c8931e214f52b8fb6780617b8318906b-uncropped_scaled_within_1536_1152.jpg",
      "access_date": "2026-08-18",
      "category": "exterior",
      "width": 810,
      "height": 1080,
      "stock_or_illustrative": false,
      "stock_basis": null,
      "property_match": "confirmed_human",
      "match_basis": "Published for 524 Lincoln Ave by the owner's property manager and confirmed by Glen as the subject building.",
      "reviewed_by": "Glen Scher",
      "reviewed_at": "2026-08-18T00:00:00Z",
      "rights_holder": "Property owner / Focus Property Services Inc.",
      "publication_basis": "seller_provided",
      "usage_scope": "LAAA valuation materials for the property owner",
      "required_credit": null,
      "status": "published",
      "rejected_reason": null,
      "rendered_width": 810,
      "rendered_height": 1080,
      "exception_id": null
    },
    {
      "id": "img-009",
      "filename": "zillow-8d73a893.jpg",
      "sha256": "c1165d94e4ec3319caa97619a55e37171bf117bd0cee41c8f2225125a9d3f64c",
      "phash": "9fffb050c1e8c324",
      "source": "listing_portal",
      "source_url": "https://photos.zillowstatic.com/fp/8d73a8934f44e0b45d2718bbb3ca741b-uncropped_scaled_within_1536_1152.jpg",
      "access_date": "2026-08-18",
      "category": "exterior",
      "width": 1440,
      "height": 1080,
      "stock_or_illustrative": false,
      "stock_basis": null,
      "property_match": "confirmed_human",
      "match_basis": "Published for 524 Lincoln Ave by the owner's property manager and confirmed by Glen as the subject building.",
      "reviewed_by": "Glen Scher",
      "reviewed_at": "2026-08-18T00:00:00Z",
      "rights_holder": "Property owner / Focus Property Services Inc.",
      "publication_basis": "seller_provided",
      "usage_scope": "LAAA valuation materials for the property owner",
      "required_credit": null,
      "status": "published",
      "rejected_reason": null,
      "rendered_width": 1440,
      "rendered_height": 1080,
      "exception_id": null
    },
    {
      "id": "img-010",
      "filename": "zillow-7ecc0e3e.jpg",
      "sha256": "67aa691165ddb705c331e18c2c96da218b9c3f55e5f9fa96d35d833ae1fe3e75",
      "phash": "bbc0647d81e41f78",
      "source": "listing_portal",
      "source_url": "https://photos.zillowstatic.com/fp/7ecc0e3e16261eca9e32d10745fcf842-uncropped_scaled_within_1536_1152.jpg",
      "access_date": "2026-08-18",
      "category": "exterior",
      "width": 864,
      "height": 1152,
      "stock_or_illustrative": false,
      "stock_basis": null,
      "property_match": "confirmed_human",
      "match_basis": "Published for 524 Lincoln Ave by the owner's property manager and confirmed by Glen as the subject building.",
      "reviewed_by": "Glen Scher",
      "reviewed_at": "2026-08-18T00:00:00Z",
      "rights_holder": "Property owner / Focus Property Services Inc.",
      "publication_basis": "seller_provided",
      "usage_scope": "LAAA valuation materials for the property owner",
      "required_credit": null,
      "status": "published",
      "rejected_reason": null,
      "rendered_width": 864,
      "rendered_height": 1152,
      "exception_id": null
    },
    {
      "id": "img-014",
      "filename": "zillow-f4f252f9.jpg",
      "sha256": "15e6aa7c9a933fe5c5a2a20abe918a0606f1c36f45f5ac4f56a649bc456b8953",
      "phash": "f2874172b1b8ba3c",
      "source": "listing_portal",
      "source_url": "https://photos.zillowstatic.com/fp/f4f252f9f512f212512e00abbf1c8205-uncropped_scaled_within_1536_1152.jpg",
      "access_date": "2026-08-18",
      "category": "exterior",
      "width": 1440,
      "height": 1080,
      "stock_or_illustrative": false,
      "stock_basis": null,
      "property_match": "confirmed_human",
      "match_basis": "Published for 524 Lincoln Ave by the owner's property manager and confirmed by Glen as the subject building.",
      "reviewed_by": "Glen Scher",
      "reviewed_at": "2026-08-18T00:00:00Z",
      "rights_holder": "Property owner / Focus Property Services Inc.",
      "publication_basis": "seller_provided",
      "usage_scope": "LAAA valuation materials for the property owner",
      "required_credit": null,
      "status": "published",
      "rejected_reason": null,
      "rendered_width": 1440,
      "rendered_height": 1080,
      "exception_id": null
    },
    {
      "id": "img-015",
      "filename": "zillow-5a30cc7c.jpg",
      "sha256": "d7ae20d255d8ccf32e496a213b5ee2115ba6b4b30eb3e090b20e156d27b1b610",
      "phash": "d5cb2252eda55a4a",
      "source": "listing_portal",
      "source_url": "https://photos.zillowstatic.com/fp/5a30cc7c924e6c362f308d0139330de9-uncropped_scaled_within_1536_1152.jpg",
      "access_date": "2026-08-18",
      "category": "exterior",
      "width": 1440,
      "height": 1080,
      "stock_or_illustrative": false,
      "stock_basis": null,
      "property_match": "confirmed_human",